{
  "objectClassName": "domain",
  "handle": "88133367_DOMAIN_COM-VRSN",
  "ldhName": "HHGAMES.COM",
  "links": [
    {
      "value": "https://rdap.verisign.com/com/v1/domain/HHGAMES.COM",
      "rel": "self",
      "href": "https://rdap.verisign.com/com/v1/domain/HHGAMES.COM",
      "type": "application/rdap+json"
    },
    {
      "value": "https://rdap.fabulous.com/rdap/domain/HHGAMES.COM",
      "rel": "related",
      "href": "https://rdap.fabulous.com/rdap/domain/HHGAMES.COM",
      "type": "application/rdap+json"
    }
  ],
  "status": [
    "client delete prohibited",
    "client transfer prohibited",
    "client update prohibited"
  ],
  "entities": [
    {
      "objectClassName": "entity",
      "handle": "411",
      "roles": [
        "registrar"
      ],
      "links": [
        {
          "href": "http://www.fabulous.com",
          "type": "text/html",
          "value": "https://rdap.fabulous.com/rdap/",
          "rel": "about"
        }
      ],
      "publicIds": [
        {
          "type": "IANA Registrar ID",
          "identifier": "411"
        }
      ],
      "vcardArray": [
        "vcard",
        [
          [
            "version",
            {},
            "text",
            "4.0"
          ],
          [
            "fn",
            {},
            "text",
            "Sea Wasp, LLC"
          ]
        ]
      ],
      "entities": [
        {
          "objectClassName": "entity",
          "roles": [
            "abuse"
          ],
          "vcardArray": [
            "vcard",
            [
              [
                "version",
                {},
                "text",
                "4.0"
              ],
              [
                "fn",
                {},
                "text",
                ""
              ],
              [
                "tel",
                {
                  "type": "voice"
                },
                "uri",
                "tel:+1.5045078209"
              ],
              [
                "email",
                {},
                "text",
                "abuse@fabulous.com"
              ]
            ]
          ]
        }
      ]
    }
  ],
  "events": [
    {
      "eventAction": "registration",
      "eventDate": "2002-07-04T19:15:32Z"
    },
    {
      "eventAction": "expiration",
      "eventDate": "2026-07-04T19:21:02Z"
    },
    {
      "eventAction": "last changed",
      "eventDate": "2025-04-16T04:27:20Z"
    },
    {
      "eventAction": "last update of RDAP database",
      "eventDate": "2025-08-05T15:37:05Z"
    }
  ],
  "secureDNS": {
    "delegationSigned": false
  },
  "nameservers": [
    {
      "objectClassName": "nameserver",
      "ldhName": "NS1.FABULOUS.COM"
    },
    {
      "objectClassName": "nameserver",
      "ldhName": "NS2.FABULOUS.COM"
    },
    {
      "objectClassName": "nameserver",
      "ldhName": "NS3.FABULOUS.COM"
    },
    {
      "objectClassName": "nameserver",
      "ldhName": "NS4.FABULOUS.COM"
    }
  ],
  "rdapConformance": [
    "rdap_level_0",
    "icann_rdap_technical_implementation_guide_1",
    "icann_rdap_response_profile_1"
  ],
  "notices": [
    {
      "title": "Terms of Service",
      "description": [
        "Service subject to Terms of Use."
      ],
      "links": [
        {
          "href": "https://www.verisign.com/domain-names/registration-data-access-protocol/terms-service/index.xhtml",
          "type": "text/html",
          "value": "https://rdap.verisign.com/com/v1/domain/hhgames.com",
          "rel": "terms-of-service"
        }
      ]
    },
    {
      "title": "Status Codes",
      "description": [
        "For more information on domain status codes, please visit https://icann.org/epp"
      ],
      "links": [
        {
          "href": "https://icann.org/epp",
          "type": "text/html"
        }
      ]
    },
    {
      "title": "RDDS Inaccuracy Complaint Form",
      "description": [
        "URL of the ICANN RDDS Inaccuracy Complaint Form: https://icann.org/wicf"
      ],
      "links": [
        {
          "href": "https://icann.org/wicf",
          "type": "text/html",
          "value": "https://rdap.verisign.com/com/v1/domain/hhgames.com",
          "rel": "help"
        }
      ]
    }
  ]
}