{
  "objectClassName": "domain",
  "handle": "2138514_DOMAIN_COM-EXMP",
  "ldhName": "EXAMPLE.COM",
  "links": [
    {
      "value": "https://rdap.example.com/com/v1/domain/EXAMPLE.COM",
      "rel": "self",
      "href": "https://rdap.example.com/com/v1/domain/EXAMPLE.COM",
      "type": "application/rdap+json"
    },
    {
      "value": "https://rdap.markmonitor.com/rdap/domain/EXAMPLE.COM",
      "rel": "related",
      "href": "https://rdap.markmonitor.com/rdap/domain/EXAMPLE.COM",
      "type": "application/rdap+json"
    }
  ],
  "status": [
    "client delete prohibited",
    "client transfer prohibited",
    "client update prohibited",
    "server delete prohibited",
    "server transfer prohibited",
    "server update prohibited"
  ],
  "entities": [
    {
      "objectClassName": "entity",
      "handle": "292",
      "roles": [
        "registrar"
      ],
      "publicIds": [
        {
          "type": "IANA Registrar ID",
          "identifier": "292"
        }
      ],
      "vcardArray": [
        "vcard",
        [
          [
            "version",
            {},
            "text",
            "4.0"
          ],
          [
            "fn",
            {},
            "text",
            "Example Inc."
          ]
        ]
      ],
      "entities": [
        {
          "objectClassName": "entity",
          "handle": "292",
          "roles": [
            "abuse"
          ],
          "vcardArray": [
            "vcard",
            [
              [
                "version",
                {},
                "text",
                "4.0"
              ],
              [
                "fn",
                {},
                "text",
                ""
              ],
              [
                "tel",
                {
                  "type": "voice"
                },
                "uri",
                "tel:+1.9999999999"
              ],
              [
                "email",
                {},
                "text",
                "abusecomplaints@example.com"
              ],
              [
                "adr",
                {
                  "type": "work"
                },
                "text",
                [
                  "",
                  "Suite 1234",
                  "4321 Rue Somewhere",
                  "Quebec",
                  "QC",
                  "G1V 2M2",
                  ""
                ]
              ]
            ]
          ]
        }
      ]
    }
  ],
  "events": [
    {
      "eventAction": "registration",
      "eventDate": "1997-09-15T04:00:00Z"
    },
    {
      "eventAction": "expiration",
      "eventDate": "2028-09-14T04:00:00Z"
    },
    {
      "eventAction": "last update of RDAP database",
      "eventDate": "2021-03-18T09:24:18Z"
    }
  ],
  "secureDNS": {
    "delegationSigned": false,
    "dsData": [
      {
        "keyTag": 55204,
        "algorithm": 8,
        "digestType": 2,
        "digest": "206D88653C43D99BF4567BBD7DF9C078DB357F59AA183741024D345723052E88"
      }
    ]
  },
  "nameservers": [
    {
      "objectClassName": "nameserver",
      "ldhName": "NS1.EXAMPLE.COM",
      "handle": "2138514_NS1_DOMAIN_COM-EXMP",
      "status": ["active"]
    },
    {
      "objectClassName": "nameserver",
      "ldhName": "NS2.EXAMPLE.COM",
      "handle": "2138514_NS2_DOMAIN_COM-EXEMPLE",
      "status": ["active"]
    },
    {
      "objectClassName": "nameserver",
      "ldhName": "NS3.EXAMPLE.COM",
      "handle": "2138514_NS3_DOMAIN_COM-EXEMPLE",
      "status": ["active"]
    },
    {
      "objectClassName": "nameserver",
      "ldhName": "NS4.EXAMPLE.COM",
      "handle": "2138514_NS_DOMAIN_COM-EXEMPLE",
      "status": ["active"]
    }
  ],
  "rdapConformance": [
    "rdap_level_0",
    "icann_rdap_technical_implementation_guide_0",
    "icann_rdap_response_profile_0"
  ],
  "notices": [
    {
      "title": "Terms of Use",
      "description": [
        "Service subject to Terms of Use."
      ],
      "links": [
        {
          "href": "https://www.example.com/domain-names/registration-data-access-protocol/terms-service/index.xhtml",
          "value": "https://www.example.com/domain-names/registration-data-access-protocol/terms-service/index.xhtml",
          "rel": "terms-of-service",
          "type": "text/html"
        }
      ]
    },
    {
      "title": "Status Codes",
      "description": [
        "For more information on domain status codes, please visit https://icann.org/epp"
      ],
      "links": [
        {
          "href": "https://icann.org/epp",
          "value":  "https://icann.org/epp",
          "rel": "self",
          "type": "text/html"
        }
      ]
    },
    {
      "title": "RDDS Inaccuracy Complaint Form",
      "description": [
        "URL of the ICANN RDDS Inaccuracy Complaint Form: https://icann.org/wicf"
      ],
      "links": [
        {
          "href": "https://icann.org/wicf",
          "value": "https://icann.org/wicf",
          "rel": "self",
          "type": "text/html"
        }
      ]
    }
  ]
}